{"claim_id":"sha256:cc491228ec1e8fa152edc8cbdfd8b28dd15f10b6d4a4804ce93c3de05eb57099","evidence_id":"sha256:30f760d363a2697e76e0f2e3bdee01f2a7eedcef8d9f656f1c715ca5e3ba8987","harness":{"input_sha256":{".github/workflows/cdk-cli-blackbox.yml":"sha256:0f4a0d315145bba31fbbb57d74eb87cbe4722e984722eb73ab512a525e561a4e",".python-version":"sha256:02e735b3dfe1c32833eb550b7ff8ffa17f5f2bc3fa1e7bae61a8f5a3883ce398","Makefile":"sha256:0262d5bdf0fed96acb75db5362cad458209c47c45026e8aa85e51c71da1fd5de","capabilities/cdk/compatibility.json":"sha256:26e24331c65249450c4eaa019c55abfdb918795b90802c5bb3c98acf95847605","capabilities/cdk/python-synth-execution-evidence.schema.json":"sha256:cd35930456f68f193600e8bdb26c3fbbd9a6b4c1f31d9d441c6b154aa6b311c5","localstack-core/localstack/cli/_cdk_health_probe.py":"sha256:364746a7edbeb04b5db932c7e79097960782485ddfad9af65e9d2ef7f1ec4941","localstack-core/localstack/cli/cdk.py":"sha256:5ff91068ded44552f07509dfc37ddf0bb82fce29208141c9e8a33d9dccf89639","pyproject.toml":"sha256:800196f9cb7be1b7c723edacdfed7c8916fc03d29487a6dfcd8069eb4c33b67d","requirements-test.txt":"sha256:5f3e38dc3b4cb5a447d7aa764b696e92d402411814cb99418480f81fb65f5379","scripts/run_cdk_cli_blackbox_isolated.sh":"sha256:0e451d0e24d64da17b148ac8b13e692bedf13508c705d94c663ad550fdcdce4a","tests/aws/cli/execution_evidence.py":"sha256:20a7dfdc5343353548717ba50d7f17a75ccd6037710d1df91d622cdaeb73c9a3","tests/aws/cli/fixtures/cdk_apps/python/minimal_sqs.py":"sha256:5cf8534e069dfaafa0d16eaf569a9cbfa1dabddbbb2752c8c1046b23ebdc72dd","tests/aws/cli/package-lock.json":"sha256:3ef373a339aebe1620b6280f0c07c2b868b11ee89b982529a7bd91e8db7e1d33","tests/aws/cli/package.json":"sha256:2d3162fd15c72d6260536acae6461eca4fd5f0403b9f173d3b2ab77770c5c75d","tests/aws/cli/python_synth_execution_evidence.py":"sha256:b4b2822cf87795b7e14d5b96658548e5fdd86538631ee7714ac78911035550db","tests/aws/cli/test_cdk_cli_blackbox.py":"sha256:3eb4695d346097e4a39b8b6060c63fd6df8f88476b4ce9f8b1a4e1de08f232ef","tests/aws/cli/test_cdk_cli_bootstrap_upgrade.py":"sha256:840f345bc25ec95c6474a9c5df381369b2075797c74b68054c89636b1f70650d","tests/aws/cli/test_cdk_cli_python_synth.py":"sha256:49eeabf4612fcc77e118041bc1259a1d878bce5f44ac97ec7e9eb1bc9c0701b3","tests/aws/cli/validate_junit.py":"sha256:254d59b14dc26bbf33b1bce987b667030f7e99a9bd588a97d52cabdda30b414e"}},"lanes":[{"assembly":{"contract":{"default_stack_synthesizer":true,"resource_type":"AWS::SQS::Queue","stack_name":"SynthStack","template_asset_hash":"039a840a9267a7acf895d29d5f2bd4894a720070cff12e3f10dd9852b76f4e1c","top_level_references_closed":true},"files":[{"bytes":707,"name":"SynthStack.assets.json","sha256":"sha256:a12e80233ede01b27e57a274b63b7028869d3196b99b044f3768e3e385bb0933"},{"bytes":836,"name":"SynthStack.template.json","sha256":"sha256:039a840a9267a7acf895d29d5f2bd4894a720070cff12e3f10dd9852b76f4e1c"},{"bytes":20,"name":"cdk.out","sha256":"sha256:60e7d181ca6ffeb9376ebc3d2ad23da64ca55f4870579d341aa49eca6f3774f2"},{"bytes":26003,"name":"manifest.json","sha256":"sha256:ab98579c21c0667e41f017ac2a45b805dda3a101ee5f942f8b75a433cd2c2957"},{"bytes":895,"name":"tree.json","sha256":"sha256:c9c5802c3aba4a30b58bab1b588eb9c986c4d143b32c958167ca8de57d6b9f06"}],"total_bytes":28461},"cleanup":{"assembly_output_absent":true,"completed":true},"command":{"app_sha256":"sha256:5cf8534e069dfaafa0d16eaf569a9cbfa1dabddbbb2752c8c1046b23ebdc72dd","argv_contract":"synth-python-minimal-sqs-v1","stack_name":"SynthStack"},"completed_at":"2026-08-09T10:13:47.394247Z","isolation":{"interface_names":["lo"],"profile_id":"linux-net-pid-mount-nobody-v1"},"junit":{"bytes":383,"sha256":"sha256:0f40ecda5f762361684f24184eb2056efc144943bd0ffd48ff8e0deafadc7d74"},"observed_at":"2026-08-09T10:13:45.392962Z","platform":{"id":"linux-amd64","kernel_release":"6.17.0-1020-azure","machine_arch":"x86_64","node_arch":"x64","python_version":"3.13.14"},"receipt_id":"sha256:07cc45629cad3637cdb46e6037419f85cb345eda8bb2793dd668fa489f4edeb0","record_type":"lane-receipt","result":{"duration_ms":10955,"returncode":0,"status":"pass","stderr_bytes":0,"stderr_sha256":"sha256:e3b0c44298fc1c149afbf4c8996fb92427ae41e4649b934ca495991b7852b855","stderr_truncated":false,"stdout_bytes":85,"stdout_sha256":"sha256:15169f46d11418e0fe5668e728acf697d35416d11aee4a2d88d138169ce4f0dc","stdout_truncated":false,"timed_out":false},"run":{"commit_sha":"7d2ce5f636f87785262185bce42aa497d88ee50b","event":"push","ref":"refs/heads/main","repository":"cassiolpaixao90/localstack","run_attempt":1,"run_id":31307734639,"workflow_path":".github/workflows/cdk-cli-blackbox.yml"},"scenario":{"aws_differential":false,"cleanup_required":true,"cloud_assembly_produced":true,"construct_language":"python","id":"synth-python-minimal-sqs-v1","resource_deployment_performed":false,"result":"cli-pass","user_authored_assets":false},"schema_version":1,"toolchain":{"cdk_cli_version":"2.1135.1","cloud_assembly_schema_sha256":"sha256:ba8defba06c63d1a9ae2c7218c0d089372547629205b5fcb862ddd911efef3f8","emitted_assembly_version":"52.0.0","node_version":"22.23.2","python_packages":{"aws-cdk-cloud-assembly-schema":"52.2.0","aws-cdk-lib":"2.241.0","constructs":"10.5.1","jsii":"1.127.0"}}},{"assembly":{"contract":{"default_stack_synthesizer":true,"resource_type":"AWS::SQS::Queue","stack_name":"SynthStack","template_asset_hash":"039a840a9267a7acf895d29d5f2bd4894a720070cff12e3f10dd9852b76f4e1c","top_level_references_closed":true},"files":[{"bytes":707,"name":"SynthStack.assets.json","sha256":"sha256:a12e80233ede01b27e57a274b63b7028869d3196b99b044f3768e3e385bb0933"},{"bytes":836,"name":"SynthStack.template.json","sha256":"sha256:039a840a9267a7acf895d29d5f2bd4894a720070cff12e3f10dd9852b76f4e1c"},{"bytes":20,"name":"cdk.out","sha256":"sha256:60e7d181ca6ffeb9376ebc3d2ad23da64ca55f4870579d341aa49eca6f3774f2"},{"bytes":26003,"name":"manifest.json","sha256":"sha256:ab98579c21c0667e41f017ac2a45b805dda3a101ee5f942f8b75a433cd2c2957"},{"bytes":895,"name":"tree.json","sha256":"sha256:c9c5802c3aba4a30b58bab1b588eb9c986c4d143b32c958167ca8de57d6b9f06"}],"total_bytes":28461},"cleanup":{"assembly_output_absent":true,"completed":true},"command":{"app_sha256":"sha256:5cf8534e069dfaafa0d16eaf569a9cbfa1dabddbbb2752c8c1046b23ebdc72dd","argv_contract":"synth-python-minimal-sqs-v1","stack_name":"SynthStack"},"completed_at":"2026-08-09T10:13:27.662169Z","isolation":{"interface_names":["lo"],"profile_id":"linux-net-pid-mount-nobody-v1"},"junit":{"bytes":383,"sha256":"sha256:ed633f6c7ccc710171c23dcfc3cc9c2266c6453ec836e3f5551d7b2c465ce57f"},"observed_at":"2026-08-09T10:13:25.931286Z","platform":{"id":"linux-arm64","kernel_release":"6.17.0-1020-azure","machine_arch":"aarch64","node_arch":"arm64","python_version":"3.13.14"},"receipt_id":"sha256:5e54f8e6e6dbc38470655952bf6a02d13dc4cec4fff11ef8dddd093e9390e568","record_type":"lane-receipt","result":{"duration_ms":10406,"returncode":0,"status":"pass","stderr_bytes":0,"stderr_sha256":"sha256:e3b0c44298fc1c149afbf4c8996fb92427ae41e4649b934ca495991b7852b855","stderr_truncated":false,"stdout_bytes":85,"stdout_sha256":"sha256:15169f46d11418e0fe5668e728acf697d35416d11aee4a2d88d138169ce4f0dc","stdout_truncated":false,"timed_out":false},"run":{"commit_sha":"7d2ce5f636f87785262185bce42aa497d88ee50b","event":"push","ref":"refs/heads/main","repository":"cassiolpaixao90/localstack","run_attempt":1,"run_id":31307734639,"workflow_path":".github/workflows/cdk-cli-blackbox.yml"},"scenario":{"aws_differential":false,"cleanup_required":true,"cloud_assembly_produced":true,"construct_language":"python","id":"synth-python-minimal-sqs-v1","resource_deployment_performed":false,"result":"cli-pass","user_authored_assets":false},"schema_version":1,"toolchain":{"cdk_cli_version":"2.1135.1","cloud_assembly_schema_sha256":"sha256:ba8defba06c63d1a9ae2c7218c0d089372547629205b5fcb862ddd911efef3f8","emitted_assembly_version":"52.0.0","node_version":"22.23.2","python_packages":{"aws-cdk-cloud-assembly-schema":"52.2.0","aws-cdk-lib":"2.241.0","constructs":"10.5.1","jsii":"1.127.0"}}}],"mode":"diagnostic-candidate","promotion":{"blockers":["not-reviewed-for-promotion","python-distribution-origin-not-attested","no-deploy","no-aws-differential","only-python"],"eligible":false},"record_type":"aggregate","run":{"event":"push","provider":"github-actions","run_attempt":1,"run_id":31307734639,"workflow_path":".github/workflows/cdk-cli-blackbox.yml"},"scenario":{"aws_differential":false,"cleanup_required":true,"cloud_assembly_produced":true,"construct_language":"python","id":"synth-python-minimal-sqs-v1","resource_deployment_performed":false,"result":"cli-pass","user_authored_assets":false},"schema_version":1,"subject":{"commit_sha":"7d2ce5f636f87785262185bce42aa497d88ee50b","ref":"refs/heads/main","repository":"cassiolpaixao90/localstack"},"toolchain":{"cdk_cli_version":"2.1135.1","cloud_assembly_schema_sha256":"sha256:ba8defba06c63d1a9ae2c7218c0d089372547629205b5fcb862ddd911efef3f8","emitted_assembly_version":"52.0.0","node_version":"22.23.2","npm_integrity":"sha512-g1jcMfWlyYtGamFJ/kPBOCuchl3NfwTF2UwOLTIDN0nJbGm84EAO+c8DlYnaemM8UmKFkdoq4BGdmiNL5nHWwA==","python_packages":{"aws-cdk-cloud-assembly-schema":"52.2.0","aws-cdk-lib":"2.241.0","constructs":"10.5.1","jsii":"1.127.0"}},"verification_contract":{"assembly":{"default_stack_synthesizer":true,"resource_type":"AWS::SQS::Queue","stack_name":"SynthStack","template_asset_hash":"039a840a9267a7acf895d29d5f2bd4894a720070cff12e3f10dd9852b76f4e1c","top_level_references_closed":true},"cleanup":{"assembly_output_absent":true,"completed":true}}}
